{
  "assetId": "DE-TX12763571265",
  "assetDescription": "Power Transformer in Big Substation",
  "assetStatus": "Installed",
  "industryAttributes": [
    {
      "txtype": {
        "manufacturer": "ABB",
        "type": "Power Transformer"
      }
    },
    {
      "txrating": "315 kVA"
    }
  ],
  "customAttributes": [
    {
      "name": "admsId",
      "value": "TX-P-3247",
      "category": "ADMS",
      "dataType": "admsId"
    },
    {
      "name": "gisId",
      "value": "TX-3478564378",
      "dataType": "gisId"
    }
  ],
  "workOrders": [
    {
      "workOrderId": "WO283745636485",
      "workDescription": "Inspect the transformer's gas",
      "startDate": "12/05/19",
      "workOrderStatus": "Complete",
      "assetId": "TX12763571265",
      "secondaryAttributes": [
        {
          "name": "warning",
          "value": "Beware of the dog",
          "category": "WFM",
          "dataType": "string"
        }
      ]
    },
    {
      "workOrderId": "WO283745636485",
      "workDescription": "Fix the transformer",
      "startDate": "14/05/19",
      "workOrderStatus": "Complete",
      "assetId": "TX12763571265",
      "secondaryAttributes": [
        {
          "name": "warning",
          "value": "Beware of the dog",
          "category": "WFM",
          "dataType": "string"
        }
      ]
    }
  ],
  "location": {
    "locationId": "L2378462378",
    "geometry": {
      "type": "Point",
      "coordinates": [ 34.23, -57.56 ]
    }
  }
}
